<?xml version="1.0" encoding="UTF-8"?>
<?xml-stylesheet type="text/xsl" href="employee.xsl"?>


<company xmlns:xsi="http://www.w3.org/2001/XMLSchema-instance" xsi:noNamespaceSchemaLocation="employee.xsd">
    <employee>
        <empid>1</empid>
        <empname>Raj</empname>
        <empage>45</empage>
        <empsalary>51000</empsalary>
        <empmail>dsdj@jdsbdjbsj.com</empmail>
        <empphn>1213124354</empphn>
        <empdesg>Freshie</empdesg>
        <promo>dsdsd</promo>
    </employee>
    <employee>
        <empid>2</empid>
        <empname>Amit</empname>
        <empage>50</empage>
        <empsalary>35000</empsalary>
        <empmail>dsdj@jdsbdjbsj.com</empmail>
        <empphn>1213124354</empphn>
        <empdesg>Experienced</empdesg>
        <promo>dsdsd</promo>
    </employee>
    <employee>
        <empid>3</empid>
        <empname>Mou</empname>
        <empage>59</empage>
        <empsalary>75000</empsalary>
        <empmail>dsdj@jdsbdjbsj.com</empmail>
        <empphn>1213124354</empphn>
        <empdesg>Experienced</empdesg>
        <promo>dsdsd</promo>
    </employee>
    <employee>
        <empid>4</empid>
        <empname>Nandini</empname>
        <empage>35</empage>
        <empsalary>65000</empsalary>
        <empmail>dsdj@jdsbdjbsj.com</empmail>
        <empphn>1213124354</empphn>
        <empdesg>Freshie</empdesg>
        <promo>dsdsd</promo>
    </employee>
</company>